{
  "$schema":"https://json-schema.org/draft/2020-12/schema",
  "$id":"urn:logh7:original-client-movement-breakpoint-receipt-v2",
  "title":"LOGH7 original-client movement breakpoint receipt v2 envelope",
  "type":"object",
  "additionalProperties":false,
  "required":["schemaVersion","receiptType","state","sourceMode","runtimeBindingStatus","baseReceiptBinding","v2Coverage","anchorAliases","rearmPlanBinding","debuggerBuildBinding","phaseExecutionLedger","acceptedHits","perThreadDrState","rejectedHitLog","queueCensus","operations","review","evaluation","permitIssued"],
  "$defs":{
    "sha":{"type":"string","pattern":"^[0-9A-F]{64}$"},
    "shaOrNull":{"type":["string","null"],"pattern":"^[0-9A-F]{64}$"},
    "hex":{"type":"string","pattern":"^0x[0-9A-F]+$"},
    "hexOrNull":{"type":["string","null"],"pattern":"^0x[0-9A-F]+$"},
    "stringOrNull":{"type":["string","null"]},
    "integerOrNull":{"type":["integer","null"]},
    "fileBinding":{"type":"object","additionalProperties":false,"required":["path","sha256"],"properties":{"path":{"type":"string","minLength":1},"sha256":{"$ref":"#/$defs/sha"}}},
    "alias":{"type":"object","additionalProperties":false,"required":["shortId","fullId","order","rva"],"properties":{"shortId":{"type":"string","pattern":"^MVB0[1-9]$"},"fullId":{"type":"string","minLength":1},"order":{"type":"integer","minimum":1,"maximum":9},"rva":{"$ref":"#/$defs/hex"}}},
    "command":{"type":"object","additionalProperties":false,"required":["globalCommandOrdinal","operation","anchorShortId","runtimeAddress","command","result","errorCode","rawOutputSha256","automatic"],"properties":{"globalCommandOrdinal":{"type":"integer","minimum":1,"maximum":18},"operation":{"enum":["SET","DELETE"]},"anchorShortId":{"type":"string","pattern":"^MVB0[1-9]$"},"runtimeAddress":{"$ref":"#/$defs/hex"},"command":{"type":"string","minLength":1},"result":{"enum":["SUCCESS","FAIL"]},"errorCode":{"type":"integer"},"rawOutputSha256":{"$ref":"#/$defs/sha"},"automatic":{"type":"boolean"}}},
    "phase":{"type":"object","additionalProperties":false,"required":["phaseOrdinal","phaseId","triggerAnchorShortId","triggerDebugEventOrdinal","activeBefore","commands","activeAfter","nextRequiredAnchorShortId","targetStoppedForEntireMutation","perThreadSnapshotId","beforeResumeVerification","resumeAuthorizationSha256","resumeIssued"],"properties":{"phaseOrdinal":{"type":"integer","minimum":0,"maximum":9},"phaseId":{"type":"string","minLength":1},"triggerAnchorShortId":{"type":["string","null"],"pattern":"^MVB0[1-9]$"},"triggerDebugEventOrdinal":{"$ref":"#/$defs/integerOrNull"},"activeBefore":{"type":"array","maxItems":4,"uniqueItems":true,"items":{"type":"string","pattern":"^MVB0[1-9]$"}},"commands":{"type":"array","maxItems":4,"items":{"$ref":"#/$defs/command"}},"activeAfter":{"type":"array","maxItems":4,"uniqueItems":true,"items":{"type":"string","pattern":"^MVB0[1-9]$"}},"nextRequiredAnchorShortId":{"type":["string","null"],"pattern":"^MVB0[1-9]$"},"targetStoppedForEntireMutation":{"type":"boolean"},"perThreadSnapshotId":{"type":"string","minLength":1},"beforeResumeVerification":{"enum":["NOT_RUN","PASS","FAIL","SEALED_STOPPED"]},"resumeAuthorizationSha256":{"$ref":"#/$defs/shaOrNull"},"resumeIssued":{"type":"boolean"}}},
    "acceptedHit":{"type":"object","additionalProperties":false,"required":["anchorShortId","acceptedSequence","threadId","debugEventOrdinal","phaseOrdinal","exceptionCode","firstChance","exceptionAddress","instructionPointer","breakpointExceptionAddress","preInstruction","predecessorAnchorShortId","eflags","resumeFlagSet","predecessorSuppressionClass","suppressionAuditSha256","triggerSlotIndex","preCommandDr0","preCommandDr1","preCommandDr2","preCommandDr3","preCommandDr6","preCommandDr7","preCommandActiveAnchorShortIds","preCommandStateSha256","debugEventRecordSha256","stackFingerprintSha256","acceptedCandidate"],"properties":{"anchorShortId":{"type":"string","pattern":"^MVB0[1-9]$"},"acceptedSequence":{"type":"integer","minimum":1,"maximum":9},"threadId":{"type":"integer","minimum":1},"debugEventOrdinal":{"type":"integer","minimum":1},"phaseOrdinal":{"type":"integer","minimum":1,"maximum":9},"exceptionCode":{"const":"0x80000004"},"firstChance":{"const":true},"exceptionAddress":{"$ref":"#/$defs/hex"},"instructionPointer":{"$ref":"#/$defs/hex"},"breakpointExceptionAddress":{"$ref":"#/$defs/hex"},"preInstruction":{"const":true},"predecessorAnchorShortId":{"type":["string","null"],"pattern":"^MVB0[1-9]$"},"eflags":{"$ref":"#/$defs/hex"},"resumeFlagSet":{"const":false},"predecessorSuppressionClass":{"const":"NONE"},"suppressionAuditSha256":{"$ref":"#/$defs/sha"},"triggerSlotIndex":{"type":"integer","minimum":0,"maximum":3},"preCommandDr0":{"$ref":"#/$defs/hex"},"preCommandDr1":{"$ref":"#/$defs/hex"},"preCommandDr2":{"$ref":"#/$defs/hex"},"preCommandDr3":{"$ref":"#/$defs/hex"},"preCommandDr6":{"$ref":"#/$defs/hex"},"preCommandDr7":{"$ref":"#/$defs/hex"},"preCommandActiveAnchorShortIds":{"type":"array","maxItems":4,"uniqueItems":true,"items":{"type":"string","pattern":"^MVB0[1-9]$"}},"preCommandStateSha256":{"$ref":"#/$defs/sha"},"debugEventRecordSha256":{"$ref":"#/$defs/sha"},"stackFingerprintSha256":{"$ref":"#/$defs/sha"},"acceptedCandidate":{"type":"boolean"}}},
    "threadState":{"type":"object","additionalProperties":false,"required":["threadId","contextReadSuccess","rawContextSha256","dr0","dr1","dr2","dr3","dr6","dr7","activeAnchorShortIds"],"properties":{"threadId":{"type":"integer","minimum":1},"contextReadSuccess":{"type":"boolean"},"rawContextSha256":{"$ref":"#/$defs/sha"},"dr0":{"$ref":"#/$defs/hex"},"dr1":{"$ref":"#/$defs/hex"},"dr2":{"$ref":"#/$defs/hex"},"dr3":{"$ref":"#/$defs/hex"},"dr6":{"$ref":"#/$defs/hex"},"dr7":{"$ref":"#/$defs/hex"},"activeAnchorShortIds":{"type":"array","maxItems":4,"uniqueItems":true,"items":{"type":"string","pattern":"^MVB0[1-9]$"}}}},
    "threadSnapshot":{"type":"object","additionalProperties":false,"required":["snapshotId","phaseOrdinal","debugEventOrdinal","targetState","enumeratedThreadIds","threadInventorySha256","threads","allCurrentThreadsCovered"],"properties":{"snapshotId":{"type":"string","minLength":1},"phaseOrdinal":{"type":"integer","minimum":0,"maximum":9},"debugEventOrdinal":{"type":"integer","minimum":1},"targetState":{"enum":["STOPPED_DEBUG_EVENT","SYNTHETIC_STOPPED"]},"enumeratedThreadIds":{"type":"array","minItems":1,"uniqueItems":true,"items":{"type":"integer","minimum":1}},"threadInventorySha256":{"$ref":"#/$defs/sha"},"threads":{"type":"array","minItems":1,"items":{"$ref":"#/$defs/threadState"}},"allCurrentThreadsCovered":{"type":"boolean"}}},
    "lifecycle":{"type":"object","additionalProperties":false,"required":["debugEventOrdinal","eventType","threadId","appliedAtPhaseOrdinal","snapshotId","beforeContinuationVerified"],"properties":{"debugEventOrdinal":{"type":"integer","minimum":1},"eventType":{"enum":["CREATE_THREAD","EXIT_THREAD"]},"threadId":{"type":"integer","minimum":1},"appliedAtPhaseOrdinal":{"type":"integer","minimum":0,"maximum":9},"snapshotId":{"type":"string"},"beforeContinuationVerified":{"type":"boolean"}}},
    "rejectedHit":{"type":"object","additionalProperties":false,"required":["debugEventOrdinal","threadId","phaseOrdinal","candidateAnchorShortId","exceptionAddress","reason","phaseAdvanced","slotMutationCount","commandOrdinals","resumeIssued","entrySha256"],"properties":{"debugEventOrdinal":{"type":"integer","minimum":1},"threadId":{"type":"integer","minimum":1},"phaseOrdinal":{"type":"integer","minimum":0,"maximum":9},"candidateAnchorShortId":{"type":"string","pattern":"^MVB0[1-9]$"},"exceptionAddress":{"$ref":"#/$defs/hex"},"reason":{"type":"string","minLength":1},"phaseAdvanced":{"type":"boolean"},"slotMutationCount":{"type":"integer","minimum":0},"commandOrdinals":{"type":"array","items":{"type":"integer","minimum":1}},"resumeIssued":{"type":"boolean"},"entrySha256":{"$ref":"#/$defs/sha"}}},
    "queueEntry":{"type":"object","additionalProperties":false,"required":["slot","expectedOpcode","movementCommandOrdinal","payloadSha256","rawEntrySha256"],"properties":{"slot":{"type":"integer","minimum":0},"expectedOpcode":{"$ref":"#/$defs/hex"},"movementCommandOrdinal":{"type":"integer","minimum":1},"payloadSha256":{"$ref":"#/$defs/sha"},"rawEntrySha256":{"$ref":"#/$defs/sha"}}}
  },
  "properties":{
    "schemaVersion":{"const":2},
    "receiptType":{"const":"ORIGINAL_CLIENT_MOVEMENT_BREAKPOINT_RECEIPT_V2"},
    "state":{"enum":["EMPTY_TEMPLATE_NOT_LIVE","SYNTHETIC_SEMANTIC_SPECIMEN","LIVE_CAPTURE_UNREVIEWED","LIVE_CAPTURE_REVIEWED_PASS","LIVE_CAPTURE_REVIEWED_FAIL"]},
    "sourceMode":{"enum":["NOT_RUN","SYNTHETIC_TEST_ONLY","LIVE_READONLY"]},
    "runtimeBindingStatus":{"enum":["UNSEEN","SYNTHETIC_SPECIMEN_ONLY","LIVE_UNREVIEWED","ORIGINAL_RUNTIME_OBSERVED"]},
    "baseReceiptBinding":{"type":"object","additionalProperties":false,"required":["path","sha256","verifierPath","verifierSha256","expectedState","expectedRuntimeBindingStatus"],"properties":{"path":{"type":"string"},"sha256":{"$ref":"#/$defs/sha"},"verifierPath":{"type":"string"},"verifierSha256":{"$ref":"#/$defs/sha"},"expectedState":{"type":"string"},"expectedRuntimeBindingStatus":{"type":"string"}}},
    "v2Coverage":{"type":"array","minItems":8,"maxItems":8,"uniqueItems":true,"items":{"type":"object","additionalProperties":false,"required":["fieldId","jsonPointer","status"],"properties":{"fieldId":{"type":"string"},"jsonPointer":{"type":"string"},"status":{"enum":["MISSING","SYNTHETIC_ONLY","LIVE_UNREVIEWED","LIVE_REVIEWED_PASS"]}}}},
    "anchorAliases":{"type":"array","minItems":9,"maxItems":9,"items":{"$ref":"#/$defs/alias"}},
    "rearmPlanBinding":{"type":"object","additionalProperties":false,"required":["planId","schemaVersion","path","sha256","traceSha256","targetSha256","movementLedgerSha256","reviewPath","reviewSha256","reviewStatus","debuggerSemanticsPath","debuggerSemanticsSha256","debugEventSuspensionEvidence","executeBreakpointTimingEvidence","runtimeNoMissProof"],"properties":{"planId":{"const":"ORIGINAL_CLIENT_MOVEMENT_HARDWARE_REARM_PLAN"},"schemaVersion":{"const":1},"path":{"type":"string"},"sha256":{"$ref":"#/$defs/sha"},"traceSha256":{"$ref":"#/$defs/sha"},"targetSha256":{"$ref":"#/$defs/sha"},"movementLedgerSha256":{"$ref":"#/$defs/sha"},"reviewPath":{"type":"string"},"reviewSha256":{"$ref":"#/$defs/sha"},"reviewStatus":{"const":"APPROVE"},"debuggerSemanticsPath":{"type":"string"},"debuggerSemanticsSha256":{"$ref":"#/$defs/sha"},"debugEventSuspensionEvidence":{"enum":["AUTHORITATIVE_STATIC_PASS","NOT_BOUND"]},"executeBreakpointTimingEvidence":{"enum":["AUTHORITATIVE_STATIC_PASS","NOT_BOUND"]},"runtimeNoMissProof":{"const":"MISSING"}}},
    "debuggerBuildBinding":{"type":"object","additionalProperties":false,"required":["architecture","commit","commitHashFile","files","bindingMode"],"properties":{"architecture":{"const":"x86"},"commit":{"type":"string","pattern":"^[0-9a-f]{40}$"},"commitHashFile":{"type":"object","additionalProperties":false,"required":["path","sha256","normalizedContent"],"properties":{"path":{"type":"string"},"sha256":{"$ref":"#/$defs/sha"},"normalizedContent":{"type":"string","pattern":"^[0-9a-f]{40}$"}}},"files":{"type":"array","minItems":3,"maxItems":3,"items":{"type":"object","additionalProperties":false,"required":["role","path","sha256"],"properties":{"role":{"enum":["x32dbg.exe","x32dbg.dll","x32gui.dll"]},"path":{"type":"string"},"sha256":{"$ref":"#/$defs/sha"}}}},"bindingMode":{"enum":["OFFLINE_HASH_BOUND","SYNTHETIC_TEST_ONLY","LIVE_READONLY"]}}},
    "phaseExecutionLedger":{"type":"object","additionalProperties":false,"required":["traceSha256","continuePolicy","phaseCount","commandCount","setCommandCount","deleteCommandCount","peakActiveSlots","phases"],"properties":{"traceSha256":{"$ref":"#/$defs/sha"},"continuePolicy":{"const":"CONTINUE_DEBUG_EVENT_NO_DBG_REPLY_LATER"},"phaseCount":{"type":"integer","minimum":0,"maximum":10},"commandCount":{"type":"integer","minimum":0,"maximum":18},"setCommandCount":{"type":"integer","minimum":0,"maximum":9},"deleteCommandCount":{"type":"integer","minimum":0,"maximum":9},"peakActiveSlots":{"type":"integer","minimum":0,"maximum":4},"phases":{"type":"array","maxItems":10,"items":{"$ref":"#/$defs/phase"}}}},
    "acceptedHits":{"type":"array","maxItems":9,"items":{"$ref":"#/$defs/acceptedHit"}},
    "perThreadDrState":{"type":"object","additionalProperties":false,"required":["snapshots","lifecycleEvents"],"properties":{"snapshots":{"type":"array","maxItems":10,"items":{"$ref":"#/$defs/threadSnapshot"}},"lifecycleEvents":{"type":"array","items":{"$ref":"#/$defs/lifecycle"}}}},
    "rejectedHitLog":{"type":"object","additionalProperties":false,"required":["observationStartDebugEventOrdinal","observationEndDebugEventOrdinal","complete","count","entries","hardwareBreakpointEventCount","hardwareBreakpointEventOrdinals","rawTranscriptSha256","logSha256"],"properties":{"observationStartDebugEventOrdinal":{"$ref":"#/$defs/integerOrNull"},"observationEndDebugEventOrdinal":{"$ref":"#/$defs/integerOrNull"},"complete":{"type":"boolean"},"count":{"type":"integer","minimum":0},"entries":{"type":"array","items":{"$ref":"#/$defs/rejectedHit"}},"hardwareBreakpointEventCount":{"type":"integer","minimum":0},"hardwareBreakpointEventOrdinals":{"type":"array","uniqueItems":true,"items":{"type":"integer","minimum":1}},"rawTranscriptSha256":{"$ref":"#/$defs/shaOrNull"},"logSha256":{"$ref":"#/$defs/shaOrNull"}}},
    "queueCensus":{"type":"object","additionalProperties":false,"required":["policy","phaseOrdinal","debugEventOrdinal","pendingCount","entries","matchingExpectedOpcodeCount","selectedQueueSlot","uniquePendingExpected0B07","postDecrementCount","postDecrementPhaseOrdinal","postDecrementDebugEventOrdinal","postDecrementEvidenceSha256","censusSha256"],"properties":{"policy":{"const":"EXACTLY_ONE_EXPECTED_0X0B07_AMONG_PENDING"},"phaseOrdinal":{"$ref":"#/$defs/integerOrNull"},"debugEventOrdinal":{"$ref":"#/$defs/integerOrNull"},"pendingCount":{"$ref":"#/$defs/integerOrNull"},"entries":{"type":"array","items":{"$ref":"#/$defs/queueEntry"}},"matchingExpectedOpcodeCount":{"$ref":"#/$defs/integerOrNull"},"selectedQueueSlot":{"$ref":"#/$defs/integerOrNull"},"uniquePendingExpected0B07":{"type":"boolean"},"postDecrementCount":{"$ref":"#/$defs/integerOrNull"},"postDecrementPhaseOrdinal":{"$ref":"#/$defs/integerOrNull"},"postDecrementDebugEventOrdinal":{"$ref":"#/$defs/integerOrNull"},"postDecrementEvidenceSha256":{"$ref":"#/$defs/shaOrNull"},"censusSha256":{"$ref":"#/$defs/shaOrNull"}}},
    "operations":{"type":"object","additionalProperties":false,"required":["guestOperations","debuggerAttach","debuggerCommands","successfulSetCommands","successfulDeleteCommands","processMemoryReads","processMemoryWrites","softwareInt3Breakpoints","physicalActivations","automaticInputs","binaryPatches","vmLifecycleChanges","serverProtocolDbChanges"],"properties":{"guestOperations":{"type":"integer","minimum":0},"debuggerAttach":{"type":"integer","minimum":0,"maximum":1},"debuggerCommands":{"type":"integer","minimum":0,"maximum":18},"successfulSetCommands":{"type":"integer","minimum":0,"maximum":9},"successfulDeleteCommands":{"type":"integer","minimum":0,"maximum":9},"processMemoryReads":{"type":"integer","minimum":0},"processMemoryWrites":{"const":0},"softwareInt3Breakpoints":{"const":0},"physicalActivations":{"type":"integer","minimum":0},"automaticInputs":{"const":0},"binaryPatches":{"const":0},"vmLifecycleChanges":{"const":0},"serverProtocolDbChanges":{"const":0}}},
    "review":{"type":"object","additionalProperties":false,"required":["status","reviewer","artifactPath","artifactSha256"],"properties":{"status":{"enum":["NOT_REVIEWED","PASS","FAIL"]},"reviewer":{"$ref":"#/$defs/stringOrNull"},"artifactPath":{"$ref":"#/$defs/stringOrNull"},"artifactSha256":{"$ref":"#/$defs/shaOrNull"}}},
    "evaluation":{"type":"object","additionalProperties":false,"required":["fieldGroupsPresent","baseReceiptValid","planBound","debuggerBuildBound","phaseLedgerValid","acceptedHitsValid","perThreadDrValid","rejectedHitsValid","queueCensusValid","runtimeNoMissProof","liveReceiptEligible","blockers"],"properties":{"fieldGroupsPresent":{"type":"boolean"},"baseReceiptValid":{"type":"boolean"},"planBound":{"type":"boolean"},"debuggerBuildBound":{"type":"boolean"},"phaseLedgerValid":{"type":"boolean"},"acceptedHitsValid":{"type":"boolean"},"perThreadDrValid":{"type":"boolean"},"rejectedHitsValid":{"type":"boolean"},"queueCensusValid":{"type":"boolean"},"runtimeNoMissProof":{"const":"MISSING"},"liveReceiptEligible":{"type":"boolean"},"blockers":{"type":"array","uniqueItems":true,"items":{"type":"string"}}}},
    "permitIssued":{"const":false}
  }
}
