{
  "schemaVersion":2,
  "receiptType":"ORIGINAL_CLIENT_MOVEMENT_BREAKPOINT_RECEIPT_V2",
  "state":"EMPTY_TEMPLATE_NOT_LIVE",
  "sourceMode":"NOT_RUN",
  "runtimeBindingStatus":"UNSEEN",
  "baseReceiptBinding":{"path":"work/20260828-original-client-movement-breakpoint-receipt-schema/evidence/movement-breakpoint-receipt-template.json","sha256":"122B8555BF25E752AE82958F14188669FCCE6B7FFB9BF4A9307CF1EA0DE9AD5A","verifierPath":"work/20260828-original-client-movement-breakpoint-receipt-schema/src/verify-movement-breakpoint-receipt.ps1","verifierSha256":"299648AED08C07A75B31A0E52D2A59A6AAE35C0B24E7E46CAD0D7452B9B1BCFF","expectedState":"EMPTY_TEMPLATE_NOT_LIVE","expectedRuntimeBindingStatus":"UNSEEN"},
  "v2Coverage":[
    {"fieldId":"HIT_THREAD_ID_AND_DEBUG_EVENT_ORDINAL","jsonPointer":"/acceptedHits","status":"MISSING"},
    {"fieldId":"TEMPORAL_REARM_PHASE_LEDGER","jsonPointer":"/phaseExecutionLedger/phases","status":"MISSING"},
    {"fieldId":"PER_THREAD_DR_STATE_RECEIPT","jsonPointer":"/perThreadDrState","status":"MISSING"},
    {"fieldId":"REJECTED_HIT_LOG","jsonPointer":"/rejectedHitLog","status":"MISSING"},
    {"fieldId":"UNIQUE_PENDING_0X0B07_QUEUE_CENSUS","jsonPointer":"/queueCensus","status":"MISSING"},
    {"fieldId":"REARM_PLAN_VERSION_AND_ARTIFACT_SHA256","jsonPointer":"/rearmPlanBinding","status":"MISSING"},
    {"fieldId":"INSTALLED_X32DBG_EXE_DLL_GUI_AND_COMMITHASH_BINDING","jsonPointer":"/debuggerBuildBinding","status":"MISSING"},
    {"fieldId":"PER_PHASE_BPHWC_BPHWS_COMMAND_RESULT_PRE_POST_ACTIVE_SET_AND_BEFORE_RESUME_VERIFICATION","jsonPointer":"/phaseExecutionLedger/phases/*","status":"MISSING"}
  ],
  "anchorAliases":[
    {"shortId":"MVB01","fullId":"MVB01_HANDLER_CALLBACK","order":1,"rva":"0x001737D0"},
    {"shortId":"MVB02","fullId":"MVB02_PAYLOAD_READY","order":2,"rva":"0x000B490E"},
    {"shortId":"MVB03","fullId":"MVB03_EXPECTED_SET","order":3,"rva":"0x000B7EDE"},
    {"shortId":"MVB04","fullId":"MVB04_COMMAND_SET","order":4,"rva":"0x000B7EE3"},
    {"shortId":"MVB05","fullId":"MVB05_TRANSPORT_SEND","order":5,"rva":"0x000B85B6"},
    {"shortId":"MVB06","fullId":"MVB06_NOTIFY_DISPATCH","order":6,"rva":"0x000BCF4F"},
    {"shortId":"MVB07","fullId":"MVB07_NOTIFY_APPLIED","order":7,"rva":"0x000BCF7E"},
    {"shortId":"MVB08","fullId":"MVB08_EXPECTED_OPCODE_COMPARE","order":8,"rva":"0x000BDD91"},
    {"shortId":"MVB09","fullId":"MVB09_QUEUE_DECREMENTED","order":9,"rva":"0x000BDDE2"}
  ],
  "rearmPlanBinding":{"planId":"ORIGINAL_CLIENT_MOVEMENT_HARDWARE_REARM_PLAN","schemaVersion":1,"path":"work/20260828-original-client-movement-hardware-rearm-plan/evidence/hardware-rearm-plan.json","sha256":"54192253616B5CE26F81A87276BD861B15069677E8F3EEDD6C3FA903D8DE665D","traceSha256":"FE3E9046EA15DE5E64F1E7CF1159E3D6F3B72CC94C14AB1200E87B2F7243D8CA","targetSha256":"BD19263C10DECC3D58373165A82D42A9267868400D407DA87D5F4F4109AB6E16","movementLedgerSha256":"9BC141E9C2F9AA7A0EF6BADF9B63CED2822F3E5D7AF820382F38803523ED3B99","reviewPath":"work/20260828-original-client-movement-hardware-rearm-plan/evidence/independent-review.md","reviewSha256":"ED8C2EB6DD3555219B40833E62028F144FC31AC360F2BA4E312F79A10B63C2A4","reviewStatus":"APPROVE","debuggerSemanticsPath":"work/20260829-original-client-movement-breakpoint-receipt-v2/evidence/authoritative-debugger-semantics.json","debuggerSemanticsSha256":"6DC0AAA072E06749A286C38F3232DD682945FAEEDC2CF7DD97D17FA798C935C8","debugEventSuspensionEvidence":"AUTHORITATIVE_STATIC_PASS","executeBreakpointTimingEvidence":"AUTHORITATIVE_STATIC_PASS","runtimeNoMissProof":"MISSING"},
  "debuggerBuildBinding":{"architecture":"x86","commit":"9c8ca1cae0b6d56cc44f31fddcb10e3b02ffbb87","commitHashFile":{"path":"C:/Users/user/Tools/x64dbg-2026.05.27/commithash.txt","sha256":"80A7077840C2DD987861A857DB19C06279408E0344B0AD13538217075A0E2C67","normalizedContent":"9c8ca1cae0b6d56cc44f31fddcb10e3b02ffbb87"},"files":[{"role":"x32dbg.exe","path":"C:/Users/user/Tools/x64dbg-2026.05.27/release/x32/x32dbg.exe","sha256":"822028F0755DBA773E445EAF57FDB3DBA84C9550AC7BDAD2AFA449912B5FBA41"},{"role":"x32dbg.dll","path":"C:/Users/user/Tools/x64dbg-2026.05.27/release/x32/x32dbg.dll","sha256":"1C2A4A10E0D1C33FE230277E3A4C64AE5E18C165C9D6AED58B1F37E2CE9812FC"},{"role":"x32gui.dll","path":"C:/Users/user/Tools/x64dbg-2026.05.27/release/x32/x32gui.dll","sha256":"74090ABE1FF077AB0C56F3B96D18314E7706B867345ABDD05891652F69A96853"}],"bindingMode":"OFFLINE_HASH_BOUND"},
  "phaseExecutionLedger":{"traceSha256":"FE3E9046EA15DE5E64F1E7CF1159E3D6F3B72CC94C14AB1200E87B2F7243D8CA","continuePolicy":"CONTINUE_DEBUG_EVENT_NO_DBG_REPLY_LATER","phaseCount":0,"commandCount":0,"setCommandCount":0,"deleteCommandCount":0,"peakActiveSlots":0,"phases":[]},
  "acceptedHits":[],
  "perThreadDrState":{"snapshots":[],"lifecycleEvents":[]},
  "rejectedHitLog":{"observationStartDebugEventOrdinal":null,"observationEndDebugEventOrdinal":null,"complete":false,"count":0,"entries":[],"hardwareBreakpointEventCount":0,"hardwareBreakpointEventOrdinals":[],"rawTranscriptSha256":null,"logSha256":null},
  "queueCensus":{"policy":"EXACTLY_ONE_EXPECTED_0X0B07_AMONG_PENDING","phaseOrdinal":null,"debugEventOrdinal":null,"pendingCount":null,"entries":[],"matchingExpectedOpcodeCount":null,"selectedQueueSlot":null,"uniquePendingExpected0B07":false,"postDecrementCount":null,"postDecrementPhaseOrdinal":null,"postDecrementDebugEventOrdinal":null,"postDecrementEvidenceSha256":null,"censusSha256":null},
  "operations":{"guestOperations":0,"debuggerAttach":0,"debuggerCommands":0,"successfulSetCommands":0,"successfulDeleteCommands":0,"processMemoryReads":0,"processMemoryWrites":0,"softwareInt3Breakpoints":0,"physicalActivations":0,"automaticInputs":0,"binaryPatches":0,"vmLifecycleChanges":0,"serverProtocolDbChanges":0},
  "review":{"status":"NOT_REVIEWED","reviewer":null,"artifactPath":null,"artifactSha256":null},
  "evaluation":{"fieldGroupsPresent":true,"baseReceiptValid":true,"planBound":true,"debuggerBuildBound":true,"phaseLedgerValid":false,"acceptedHitsValid":false,"perThreadDrValid":false,"rejectedHitsValid":false,"queueCensusValid":false,"runtimeNoMissProof":"MISSING","liveReceiptEligible":false,"blockers":["FRESH_MOVEMENT_BREAKPOINT_INSTALL_AND_PER_THREAD_TEMPORAL_RECEIPT_MISSING","INDEPENDENT_LIVE_REVIEW_MISSING"]},
  "permitIssued":false
}
